{
  "schema_version": "videoguard_video_parse_v2",
  "coverage": {
    "status": "FULL",
    "video_start_ms": 0,
    "video_end_ms": 24000,
    "modalities": {
      "visual": "FULL",
      "speech": "FULL",
      "screen_text": "FULL",
      "sound": "FULL"
    },
    "limitations": [],
    "time_localization": "RELIABLE"
  },
  "timeline": {
    "shots": [
      {
        "shot_id": "S001",
        "start_ms": 0,
        "end_ms": 6000,
        "continuity": "CUT",
        "scene_summary": "博主在室内开场",
        "quality": {
          "visual_clarity": "CLEAR",
          "speech_clarity": "CLEAR",
          "audio": {
            "status": "PASS",
            "voice_clarity": "PASS",
            "bgm_interference": "PASS",
            "evidence": "口播清晰，无持续背景噪声。",
            "evidence_refs": [
              "S001:F001"
            ],
            "limitations": []
          },
          "visual": {
            "clarity": "PASS",
            "pixelation": "PASS",
            "aliasing_candidate": "PASS",
            "evidence": "该镜头无新增视觉判断。",
            "evidence_refs": [],
            "limitations": [
              "该镜头没有可定位的视觉证据，未据此判断画质。"
            ]
          },
          "limitations": []
        },
        "visual_facts": [],
        "speech_transcript": [
          {
            "fact_id": "F001",
            "start_ms": 200,
            "end_ms": 4800,
            "summary_zh": "博主说明本期内容主题。",
            "verbatim_redacted": "今天讲一个话题",
            "confidence": "HIGH",
            "limitations": []
          }
        ],
        "subtitle_text": [],
        "screen_text": [],
        "audio_observations": []
      },
      {
        "shot_id": "S002",
        "start_ms": 6000,
        "end_ms": 15000,
        "continuity": "CUT",
        "scene_summary": "口播引导参与无法核实的高收益活动",
        "quality": {
          "visual_clarity": "CLEAR",
          "speech_clarity": "CLEAR",
          "audio": {
            "status": "PASS",
            "voice_clarity": "PASS",
            "bgm_interference": "PASS",
            "evidence": "口播清晰。",
            "evidence_refs": [
              "S002:F001"
            ],
            "limitations": []
          },
          "visual": {
            "clarity": "PASS",
            "pixelation": "PASS",
            "aliasing_candidate": "PASS",
            "evidence": "该镜头无新增视觉判断。",
            "evidence_refs": [],
            "limitations": [
              "该镜头没有可定位的视觉证据，未据此判断画质。"
            ]
          },
          "limitations": []
        },
        "visual_facts": [],
        "speech_transcript": [
          {
            "fact_id": "F001",
            "start_ms": 6200,
            "end_ms": 14500,
            "summary_zh": "口播引导观众参与无法核实的高收益活动。",
            "verbatim_redacted": "投进来就能翻倍，稳赚不赔",
            "confidence": "HIGH",
            "limitations": []
          }
        ],
        "subtitle_text": [],
        "screen_text": [],
        "audio_observations": []
      },
      {
        "shot_id": "S003",
        "start_ms": 15000,
        "end_ms": 19000,
        "continuity": "CUT",
        "scene_summary": "补充说明",
        "quality": {
          "visual_clarity": "CLEAR",
          "speech_clarity": "CLEAR",
          "audio": {
            "status": "PASS",
            "voice_clarity": "PASS",
            "bgm_interference": "PASS",
            "evidence": "口播清晰，无持续背景噪声。",
            "evidence_refs": [
              "S003:F001"
            ],
            "limitations": []
          },
          "visual": {
            "clarity": "PASS",
            "pixelation": "PASS",
            "aliasing_candidate": "PASS",
            "evidence": "该镜头无新增视觉判断。",
            "evidence_refs": [],
            "limitations": [
              "该镜头没有可定位的视觉证据，未据此判断画质。"
            ]
          },
          "limitations": []
        },
        "visual_facts": [],
        "speech_transcript": [
          {
            "fact_id": "F001",
            "start_ms": 15200,
            "end_ms": 18800,
            "summary_zh": "博主补充说明相关内容。",
            "verbatim_redacted": "以上就是相关说明",
            "confidence": "HIGH",
            "limitations": []
          }
        ],
        "subtitle_text": [],
        "screen_text": [],
        "audio_observations": []
      },
      {
        "shot_id": "S004",
        "start_ms": 19000,
        "end_ms": 24000,
        "continuity": "CUT",
        "scene_summary": "收尾",
        "quality": {
          "visual_clarity": "CLEAR",
          "speech_clarity": "CLEAR",
          "audio": {
            "status": "PASS",
            "voice_clarity": "PASS",
            "bgm_interference": "PASS",
            "evidence": "口播清晰，无持续背景噪声。",
            "evidence_refs": [
              "S004:F001"
            ],
            "limitations": []
          },
          "visual": {
            "clarity": "PASS",
            "pixelation": "PASS",
            "aliasing_candidate": "PASS",
            "evidence": "该镜头无新增视觉判断。",
            "evidence_refs": [],
            "limitations": [
              "该镜头没有可定位的视觉证据，未据此判断画质。"
            ]
          },
          "limitations": []
        },
        "visual_facts": [],
        "speech_transcript": [
          {
            "fact_id": "F001",
            "start_ms": 19200,
            "end_ms": 23500,
            "summary_zh": "博主结束视频。",
            "verbatim_redacted": "今天就到这里",
            "confidence": "HIGH",
            "limitations": []
          }
        ],
        "subtitle_text": [],
        "screen_text": [],
        "audio_observations": []
      }
    ],
    "events": [
      {
        "event_id": "EVT_MAIN",
        "start_ms": 6000,
        "end_ms": 15000,
        "event_type": "single_cue",
        "referent_key": "EVT_MAIN",
        "summary": "口播引导观众参与无法核实的高收益活动。",
        "evidence_refs": [
          "S002:F001"
        ],
        "context": {
          "stance": "UNKNOWN",
          "target_relation": "UNCERTAIN",
          "counter_context_refs": []
        },
        "uncertainties": []
      }
    ]
  },
  "video_summary": {
    "evidence_refs": [
      "S002:F001"
    ],
    "time_ranges": [
      {
        "start_ms": 6200,
        "end_ms": 14500,
        "evidence_refs": [
          "S002:F001"
        ]
      }
    ],
    "limitations": [],
    "summary_zh": "口播引导观众参与无法核实的高收益活动。"
  },
  "content_analysis": {
    "audio_visual_quality": {
      "evidence_refs": [
        "S002:F001"
      ],
      "time_ranges": [
        {
          "start_ms": 6200,
          "end_ms": 14500,
          "evidence_refs": [
            "S002:F001"
          ]
        }
      ],
      "limitations": [],
      "summary": "音画信息总体清晰，口播可辨认。",
      "issues": []
    }
  }
}
